{
  "scanId": "sb_scan_5330641f17cf",
  "project": "CascadeProjects/coming-soon",
  "timestamp": "2026-08-01T06:09:01.272Z",
  "profile": "all",
  "todoCount": 1,
  "syntheticTodoCount": 0,
  "syntheticTodoMarkers": 0,
  "syntheticTodoFiles": [],
  "sourceCounts": {},
  "meta": {
    "rawReport": {
      "type": "simplebeacon-report",
      "reportVersion": 2,
      "scan_summary": {
        "status": "FAILED",
        "block_merge": true,
        "total_risks_found": 1,
        "high_severity_count": 1,
        "medium_severity_count": 1,
        "low_severity_count": 2,
        "estimated_incident_cost_saved": "$20,000",
        "scan_id": "sb_scan_5330641f17cf",
        "timestamp": "2026-08-01T06:09:01.272Z",
        "tier": "developer",
        "scans_remaining": 9487,
        "pipeline_scan": false,
        "critical_severity_count": 0,
        "sandbox": {
          "active": false,
          "upgradeUrl": "https://simplebeacon.ai/pricing"
        }
      },
      "generatedAt": "2026-08-01T06:09:01.272Z",
      "generatedBy": "Simplebeacon",
      "projectRoot": "C:\\Users\\user\\CascadeProjects\\coming-soon",
      "configPath": "C:\\Users\\user\\CascadeProjects\\coming-soon\\.simplebeacon\\config.json",
      "scanPaths": ["C:\\Users\\user\\CascadeProjects\\coming-soon"],
      "repositoryInventory": {
        "projectRoot": "C:\\Users\\user\\CascadeProjects\\coming-soon",
        "totalFiles": 1210,
        "totalFolders": 145,
        "profile": "all"
      },
      "mockSampleFiles": 7,
      "totalFiles": 50,
      "totalLines": 537242,
      "ruleScopedFilesAnalyzed": 50,
      "repositoryFilesTotal": 1210,
      "repositoryFoldersTotal": 145,
      "filesAnalyzed": 50,
      "totalSizeBytes": 53847800,
      "totalSizeLabel": "51.4 MB",
      "issueCount": 1,
      "invalidJson": 0,
      "emptyFiles": 0,
      "schemaChecked": 0,
      "schemaPassed": 0,
      "pageSampleSchemaChecked": 0,
      "pageSampleSchemaPassed": 0,
      "duplicateGroups": 0,
      "roadmapSchemaChecked": 0,
      "roadmapSchemaPassed": 0,
      "consistencyChecked": 10,
      "consistencyPassed": 10,
      "fictionJsonFilesScanned": 10,
      "fictionSampleFilesScanned": 0,
      "fictionScope": "repository-json",
      "credentialScanned": 151,
      "credentialFindings": 2,
      "productionLeakScanned": 30,
      "productionLeakFindings": 0,
      "productionLeakSuppressedIntent": 0,
      "sourceCodeFilesScanned": 0,
      "sourceFictionPatternHits": 0,
      "llmSlopFilesScanned": 47,
      "llmSlopPatternHits": 0,
      "euAiActScanned": 0,
      "euAiActFindings": 0,
      "euAiActSummary": null,
      "securityPatternFilesScanned": 30,
      "securityPatternFindings": 0,
      "hardcodedUrlFilesScanned": 0,
      "hardcodedUrlFindings": 0,
      "weakCryptoFilesScanned": 0,
      "weakCryptoFindings": 0,
      "secretInCommentsFilesScanned": 0,
      "secretInCommentsFindings": 0,
      "syncIoFilesScanned": 0,
      "syncIoFindings": 0,
      "envInGitFilesScanned": 0,
      "envInGitFindings": 0,
      "redosFilesScanned": 0,
      "redosFindings": 0,
      "piiLoggingFilesScanned": 0,
      "piiLoggingFindings": 0,
      "deadCodeFilesScanned": 0,
      "deadCodeFindings": 0,
      "memoryLeakFilesScanned": 0,
      "memoryLeakFindings": 0,
      "typeSafetyFilesScanned": 0,
      "typeSafetyFindings": 0,
      "hallucinatedImportFilesScanned": 0,
      "hallucinatedImportFindings": 0,
      "astStructuralFilesScanned": 0,
      "astStructuralFindings": 0,
      "astAvailable": false,
      "dependencyGraphFilesScanned": 0,
      "dependencyGraphFindings": 0,
      "jestBaselineChecked": false,
      "jestBaselinePassed": true,
      "jestSummary": null,
      "severityCounts": {
        "critical": 0,
        "high": 1,
        "medium": 1,
        "low": 2
      },
      "mockDataCategories": [
        {
          "category": "Other Files",
          "fileCount": 1101,
          "totalSize": "50.5 MB",
          "qualityScore": 100,
          "issues": 0,
          "confidence": null,
          "description": "Other Files discovered during filesystem scan"
        },
        {
          "category": "Text Files",
          "fileCount": 17,
          "totalSize": "84.7 KB",
          "qualityScore": 100,
          "issues": 0,
          "confidence": null,
          "description": "Text Files discovered during filesystem scan"
        },
        {
          "category": "Documentation Files",
          "fileCount": 36,
          "totalSize": "210.7 KB",
          "qualityScore": 100,
          "issues": 0,
          "confidence": null,
          "description": "Documentation Files discovered during filesystem scan"
        },
        {
          "category": "JSON Files",
          "fileCount": 47,
          "totalSize": "535.2 KB",
          "qualityScore": 100,
          "issues": 0,
          "confidence": null,
          "description": "JSON Files discovered during filesystem scan"
        },
        {
          "category": "CSV Files",
          "fileCount": 5,
          "totalSize": "25.0 KB",
          "qualityScore": 100,
          "issues": 0,
          "confidence": null,
          "description": "CSV Files discovered during filesystem scan"
        },
        {
          "category": "Config Files",
          "fileCount": 1,
          "totalSize": "309 B",
          "qualityScore": 100,
          "issues": 0,
          "confidence": null,
          "description": "Config Files discovered during filesystem scan"
        },
        {
          "category": "Database Files",
          "fileCount": 1,
          "totalSize": "4.0 KB",
          "qualityScore": 100,
          "issues": 0,
          "confidence": null,
          "description": "Database Files discovered during filesystem scan"
        },
        {
          "category": "XML Files",
          "fileCount": 2,
          "totalSize": "4.7 KB",
          "qualityScore": 100,
          "issues": 0,
          "confidence": null,
          "description": "XML Files discovered during filesystem scan"
        }
      ],
      "compliance": {
        "licenseCount": 1,
        "securityCount": 1,
        "summary": "1 license file, 1 security/governance file detected.",
        "remediation": "Verify license compatibility with your distribution model.",
        "governanceScore": 2,
        "complianceHealth": "fair",
        "recommendations": []
      },
      "detectedIssues": [
        {
          "severity": "high",
          "severityBand": "high",
          "type": "Credential Pattern",
          "count": 1,
          "description": "C:\\Users\\user\\CascadeProjects\\coming-soon\\__audit-free-test.cjs:31 possible stripe key",
          "pattern": "stripe-key",
          "line": 31,
          "recommendation": null,
          "affectedFiles": [
            "C:\\Users\\user\\CascadeProjects\\coming-soon\\__audit-free-test.cjs"
          ],
          "filePaths": [
            "C:\\Users\\user\\CascadeProjects\\coming-soon\\__audit-free-test.cjs"
          ],
          "file": "C:\\Users\\user\\CascadeProjects\\coming-soon\\__audit-free-test.cjs"
        },
        {
          "severity": "medium",
          "severityBand": "medium",
          "type": "Credential Pattern",
          "count": 1,
          "description": "C:\\Users\\user\\CascadeProjects\\coming-soon\\__audit-free-test.cjs:31 possible generic api key",
          "pattern": "generic-api-key",
          "line": 31,
          "recommendation": null,
          "affectedFiles": [
            "C:\\Users\\user\\CascadeProjects\\coming-soon\\__audit-free-test.cjs"
          ],
          "filePaths": [
            "C:\\Users\\user\\CascadeProjects\\coming-soon\\__audit-free-test.cjs"
          ],
          "file": "C:\\Users\\user\\CascadeProjects\\coming-soon\\__audit-free-test.cjs"
        },
        {
          "severity": "low",
          "severityBand": "low",
          "type": "framework-practices",
          "count": 1,
          "description": "public/app/assets/TeamMetricsView.js:1 framework-practices pattern detected",
          "pattern": null,
          "line": 1,
          "recommendation": null,
          "affectedFiles": ["public/app/assets/TeamMetricsView.js"],
          "filePaths": ["public/app/assets/TeamMetricsView.js"],
          "file": "public/app/assets/TeamMetricsView.js"
        },
        {
          "severity": "low",
          "severityBand": "low",
          "type": "framework-practices",
          "count": 1,
          "description": "public/dashboard/assets/TeamMetricsView.js:1 framework-practices pattern detected",
          "pattern": null,
          "line": 1,
          "recommendation": null,
          "affectedFiles": ["public/dashboard/assets/TeamMetricsView.js"],
          "filePaths": ["public/dashboard/assets/TeamMetricsView.js"],
          "file": "public/dashboard/assets/TeamMetricsView.js"
        }
      ],
      "rawIssues": [
        {
          "id": "stripe-key-__audit-free-test.cjs-1390",
          "type": "Credential Pattern",
          "severity": "high",
          "severityBand": "high",
          "filePath": "C:\\Users\\user\\CascadeProjects\\coming-soon\\__audit-free-test.cjs",
          "file": "C:\\Users\\user\\CascadeProjects\\coming-soon\\__audit-free-test.cjs",
          "line": 31,
          "description": "C:\\Users\\user\\CascadeProjects\\coming-soon\\__audit-free-test.cjs:31 possible stripe key",
          "count": 1,
          "affectedFiles": [
            "C:\\Users\\user\\CascadeProjects\\coming-soon\\__audit-free-test.cjs"
          ],
          "filePaths": [
            "C:\\Users\\user\\CascadeProjects\\coming-soon\\__audit-free-test.cjs"
          ],
          "metadata": {
            "patternId": "stripe-key",
            "offset": 1390,
            "findingPayload": {
              "file": "C:\\Users\\user\\CascadeProjects\\coming-soon\\__audit-free-test.cjs",
              "line": 31,